{
  "failures": [],
  "run": {
    "commands": {
      "doh": [
        "speedns",
        "--no-defaults",
        "--protocol",
        "doh",
        "--resolver",
        "google=https://dns.google/dns-query",
        "--sample",
        "1",
        "--type",
        "A",
        "--seed",
        "42",
        "--timeout",
        "5000ms",
        "--concurrency",
        "1",
        "--format",
        "json"
      ],
      "doq": [
        "speedns",
        "--no-defaults",
        "--protocol",
        "doq",
        "--resolver",
        "quad9=quic://dns.quad9.net:853",
        "--sample",
        "1",
        "--type",
        "A",
        "--seed",
        "42",
        "--timeout",
        "5000ms",
        "--concurrency",
        "1",
        "--format",
        "json"
      ],
      "dot": [
        "speedns",
        "--no-defaults",
        "--protocol",
        "dot",
        "--resolver",
        "google=tls://dns.google:853",
        "--sample",
        "1",
        "--type",
        "A",
        "--seed",
        "42",
        "--timeout",
        "5000ms",
        "--concurrency",
        "1",
        "--format",
        "json"
      ],
      "tcp": [
        "speedns",
        "--no-defaults",
        "--protocol",
        "tcp",
        "--resolver",
        "google=tcp://8.8.8.8:53",
        "--sample",
        "1",
        "--type",
        "A",
        "--seed",
        "42",
        "--timeout",
        "5000ms",
        "--concurrency",
        "1",
        "--format",
        "json"
      ],
      "udp": [
        "speedns",
        "--no-defaults",
        "--protocol",
        "udp",
        "--resolver",
        "google=udp://8.8.8.8:53",
        "--sample",
        "1",
        "--type",
        "A",
        "--seed",
        "42",
        "--timeout",
        "5000ms",
        "--concurrency",
        "1",
        "--format",
        "json"
      ]
    },
    "corpus": {
      "entries": 1000,
      "mode": "warm-cache",
      "sha256": "800d075ad2df2472ce7741c7cc5a8470dde3c97fc7d6cf4cffd12e828d7aba7e",
      "zone": ""
    },
    "finished_at": "2026-09-21T08:52:12.884Z",
    "id": "35580111378-attempt-1",
    "outcome": "passed",
    "protocols": [
      "udp",
      "tcp",
      "doh",
      "dot",
      "doq"
    ],
    "published_at": "2026-09-21T08:52:22.006Z",
    "query_types": [
      1
    ],
    "sample_size": 1,
    "seed": 42,
    "source": {
      "commit": "3bc4ad08e4aa67664978e4572fe5bc6a1b80b474",
      "ref": "main",
      "repository": "crypt0rr/SpeeDNS",
      "workflow_run_attempt": "1",
      "workflow_run_id": "35580111378",
      "workflow_run_number": "5"
    },
    "started_at": "2026-09-21T08:52:11.936Z"
  },
  "schema_version": 1,
  "summary": [
    {
      "protocol": "udp",
      "stats": {
        "ci_high_ms": 14.437107,
        "ci_low_ms": 14.437107,
        "cold_median_ms": 14.972895,
        "divergent": 0,
        "failures": 0,
        "mad_ms": 0,
        "median_ms": 14.437107,
        "p95_ms": 14.437107,
        "recommended": false,
        "resolver_failures": 0,
        "score_ms": 14.437107,
        "scored": 1,
        "success_rate": 1,
        "successes": 1,
        "tie": false,
        "total": 1,
        "truncated": 0,
        "usable_rate": 1,
        "usable_responses": 1
      },
      "status": "provisional",
      "winner": {
        "address": "8.8.8.8",
        "endpoint_url": "",
        "name": "google",
        "owner": "custom",
        "policy": "user supplied",
        "target_id": "custom-google@8.8.8.8/udp",
        "tls_server_name": ""
      }
    },
    {
      "protocol": "tcp",
      "stats": {
        "ci_high_ms": 15.875168000000002,
        "ci_low_ms": 15.875168000000002,
        "cold_median_ms": 12.494267,
        "divergent": 0,
        "failures": 0,
        "mad_ms": 0,
        "median_ms": 15.875168,
        "p95_ms": 15.875168,
        "recommended": false,
        "resolver_failures": 0,
        "score_ms": 15.875168000000002,
        "scored": 1,
        "success_rate": 1,
        "successes": 1,
        "tie": false,
        "total": 1,
        "truncated": 0,
        "usable_rate": 1,
        "usable_responses": 1
      },
      "status": "provisional",
      "winner": {
        "address": "8.8.8.8",
        "endpoint_url": "",
        "name": "google",
        "owner": "custom",
        "policy": "user supplied",
        "target_id": "custom-google@8.8.8.8/tcp",
        "tls_server_name": ""
      }
    },
    {
      "protocol": "doh",
      "stats": {
        "ci_high_ms": 45.384682,
        "ci_low_ms": 45.384682,
        "cold_median_ms": 22.994984,
        "divergent": 0,
        "failures": 0,
        "mad_ms": 0,
        "median_ms": 45.384682,
        "p95_ms": 45.384682,
        "recommended": false,
        "resolver_failures": 0,
        "score_ms": 45.384682,
        "scored": 1,
        "success_rate": 1,
        "successes": 1,
        "tie": false,
        "total": 1,
        "truncated": 0,
        "usable_rate": 1,
        "usable_responses": 1
      },
      "status": "provisional",
      "winner": {
        "address": "dns.google",
        "endpoint_url": "https://dns.google/dns-query",
        "name": "google",
        "owner": "custom",
        "policy": "user supplied",
        "target_id": "custom-google@dns.google/doh",
        "tls_server_name": "dns.google"
      }
    },
    {
      "protocol": "dot",
      "stats": {
        "ci_high_ms": 12.831992,
        "ci_low_ms": 12.831992,
        "cold_median_ms": 26.809935,
        "divergent": 0,
        "failures": 0,
        "mad_ms": 0,
        "median_ms": 12.831992,
        "p95_ms": 12.831992,
        "recommended": false,
        "resolver_failures": 0,
        "score_ms": 12.831992,
        "scored": 1,
        "success_rate": 1,
        "successes": 1,
        "tie": false,
        "total": 1,
        "truncated": 0,
        "usable_rate": 1,
        "usable_responses": 1
      },
      "status": "provisional",
      "winner": {
        "address": "dns.google",
        "endpoint_url": "",
        "name": "google",
        "owner": "custom",
        "policy": "user supplied",
        "target_id": "custom-google@dns.google/dot",
        "tls_server_name": "dns.google"
      }
    },
    {
      "protocol": "doq",
      "stats": {
        "ci_high_ms": 12.358677,
        "ci_low_ms": 12.358677,
        "cold_median_ms": 31.200109,
        "divergent": 0,
        "failures": 0,
        "mad_ms": 0,
        "median_ms": 12.358677,
        "p95_ms": 12.358677,
        "recommended": false,
        "resolver_failures": 0,
        "score_ms": 12.358677,
        "scored": 1,
        "success_rate": 1,
        "successes": 1,
        "tie": false,
        "total": 1,
        "truncated": 0,
        "usable_rate": 1,
        "usable_responses": 1
      },
      "status": "provisional",
      "winner": {
        "address": "dns.quad9.net",
        "endpoint_url": "",
        "name": "quad9",
        "owner": "custom",
        "policy": "user supplied",
        "target_id": "custom-quad9@dns.quad9.net/doq",
        "tls_server_name": "dns.quad9.net"
      }
    }
  ],
  "transports": [
    {
      "endpoint": {
        "address": "8.8.8.8",
        "endpoint_url": "",
        "name": "google",
        "owner": "custom",
        "policy": "user supplied",
        "target_id": "custom-google@8.8.8.8/udp",
        "tls_server_name": ""
      },
      "protocol": "udp",
      "stats": {
        "ci_high_ms": 14.437107,
        "ci_low_ms": 14.437107,
        "cold_median_ms": 14.972895,
        "divergent": 0,
        "failures": 0,
        "mad_ms": 0,
        "median_ms": 14.437107,
        "p95_ms": 14.437107,
        "recommended": false,
        "resolver_failures": 0,
        "score_ms": 14.437107,
        "scored": 1,
        "success_rate": 1,
        "successes": 1,
        "tie": false,
        "total": 1,
        "truncated": 0,
        "usable_rate": 1,
        "usable_responses": 1
      },
      "status": "ineligible"
    },
    {
      "endpoint": {
        "address": "8.8.8.8",
        "endpoint_url": "",
        "name": "google",
        "owner": "custom",
        "policy": "user supplied",
        "target_id": "custom-google@8.8.8.8/tcp",
        "tls_server_name": ""
      },
      "protocol": "tcp",
      "stats": {
        "ci_high_ms": 15.875168000000002,
        "ci_low_ms": 15.875168000000002,
        "cold_median_ms": 12.494267,
        "divergent": 0,
        "failures": 0,
        "mad_ms": 0,
        "median_ms": 15.875168,
        "p95_ms": 15.875168,
        "recommended": false,
        "resolver_failures": 0,
        "score_ms": 15.875168000000002,
        "scored": 1,
        "success_rate": 1,
        "successes": 1,
        "tie": false,
        "total": 1,
        "truncated": 0,
        "usable_rate": 1,
        "usable_responses": 1
      },
      "status": "ineligible"
    },
    {
      "endpoint": {
        "address": "dns.google",
        "endpoint_url": "https://dns.google/dns-query",
        "name": "google",
        "owner": "custom",
        "policy": "user supplied",
        "target_id": "custom-google@dns.google/doh",
        "tls_server_name": "dns.google"
      },
      "protocol": "doh",
      "stats": {
        "ci_high_ms": 45.384682,
        "ci_low_ms": 45.384682,
        "cold_median_ms": 22.994984,
        "divergent": 0,
        "failures": 0,
        "mad_ms": 0,
        "median_ms": 45.384682,
        "p95_ms": 45.384682,
        "recommended": false,
        "resolver_failures": 0,
        "score_ms": 45.384682,
        "scored": 1,
        "success_rate": 1,
        "successes": 1,
        "tie": false,
        "total": 1,
        "truncated": 0,
        "usable_rate": 1,
        "usable_responses": 1
      },
      "status": "ineligible"
    },
    {
      "endpoint": {
        "address": "dns.google",
        "endpoint_url": "",